[
  {
    "id": "terr-001",
    "category": "terrain-missions",
    "subtopic": "terrain-traits",
    "type": "multiple-choice",
    "prompt": "Quel trait de terrain bloque généralement complètement la ligne de vue ?",
    "choices": ["Couvert Léger", "Couvert Lourd", "Insignifiant", "Obscurcissant"],
    "correctIndex": 3,
    "explanation": "Le terrain Obscurcissant bloque généralement la ligne de vue, contrairement au Couvert Léger/Lourd qui affecte l'attaque de tir plutôt que la visibilité elle-même. À vérifier avec le livre de règles actuel.",
    "status": "draft",
    "sourceRef": "TODO : vérifier avec les règles officielles de terrain de Kill Team",
    "tags": ["terrain-traits"]
  },
  {
    "id": "terr-002",
    "category": "terrain-missions",
    "subtopic": "vantage",
    "type": "true-false",
    "prompt": "Un terrain Point de Vue permet aux opératifs qui s'y trouvent de voir et d'être vus par-dessus le terrain intermédiaire, selon ses règles spécifiques.",
    "correctIndex": 0,
    "explanation": "Les points de vue accordent généralement de meilleures lignes de vue par-dessus un terrain plus bas. À vérifier avec le libellé exact du livre de règles actuel.",
    "status": "draft",
    "sourceRef": "TODO : vérifier avec les règles officielles de terrain de Kill Team",
    "tags": ["vantage"]
  },
  {
    "id": "terr-003",
    "category": "terrain-missions",
    "subtopic": "kill-zones",
    "type": "multiple-choice",
    "prompt": "Qu'est-ce qu'une « kill zone » dans le contexte d'un pack de mission Kill Team ?",
    "choices": [
      "Une disposition de terrain/champ de bataille spécifique associée à un pack de mission",
      "La zone où les opératifs blessés doivent se replier",
      "Une zone où il est interdit de tirer",
      "La zone d'insertion uniquement"
    ],
    "correctIndex": 0,
    "explanation": "Une kill zone est généralement une configuration de champ de bataille/terrain définie, associée à un pack de mission. À vérifier avec le livre de règles/pack de mission actuel.",
    "status": "draft",
    "sourceRef": "TODO : vérifier avec les règles officielles de mission de Kill Team",
    "tags": ["kill-zones"]
  },
  {
    "id": "terr-004",
    "category": "terrain-missions",
    "subtopic": "terrain-traits",
    "type": "multiple-choice",
    "prompt": "Quelle proposition décrit le mieux l'effet d'un élément de terrain « Insignifiant » sur la partie ?",
    "choices": [
      "Il bloque tout mouvement",
      "Il est trop petit/fin pour affecter significativement le couvert ou le mouvement",
      "Il accorde un Couvert Lourd à tout agent proche",
      "Il compte comme un Point de Vue"
    ],
    "correctIndex": 1,
    "explanation": "Un terrain Insignifiant est généralement traité comme trop mineur pour interagir avec la plupart des règles de terrain. À vérifier avec le livre de règles actuel.",
    "status": "draft",
    "sourceRef": "TODO : vérifier avec les règles officielles de terrain de Kill Team",
    "tags": ["terrain-traits"]
  },
  {
    "id": "terr-005",
    "category": "terrain-missions",
    "subtopic": "objectives",
    "type": "true-false",
    "prompt": "Les objectifs de mission dans Kill Team sont toujours identiques d'un pack de mission à l'autre.",
    "correctIndex": 1,
    "explanation": "Les objectifs varient selon le pack de mission et la mission spécifique jouée. À vérifier avec le pack de mission actuellement utilisé.",
    "status": "draft",
    "sourceRef": "TODO : vérifier avec les règles officielles de mission de Kill Team",
    "tags": ["objectives"]
  }
]
